03044,03 LEGUMES,"Chick peas, whole, dry, water-soaked, boiled in different water (without salt, water not discarded)",1.0,430.0,102.0,71.4,7.1,1.6,10.9,8.0,1.0,76.0,2.2,51.0,90.0,326.0,10.0,1.07,13.0,5.0,9.0,0.0,55.0,0.12,0.05,0.5,76.0,76.0,0.0,2.0
03045,03 LEGUMES,"Cowpeas, dry, unsoaked, boiled, drained (without salt)",1.0,495.0,117.0,67.1,9.5,0.4,16.2,5.4,1.4,37.0,1.9,103.0,93.0,389.0,8.0,1.14,0.0,1.0,1.0,0.0,7.0,0.22,0.04,0.6,82.0,82.0,0.0,0.0
03046,03 LEGUMES,"Cowpeas, unsoaked, boiled (without salt, water not discarded)",1.0,299.0,71.0,80.1,5.7,0.3,9.8,3.2,0.8,27.0,1.4,74.0,62.0,313.0,7.0,0.76,0.0,,,,,,,,,,,
03047,03 LEGUMES,"Cowpeas, dry, water-soaked, boiled in different water, drained (without salt)",1.0,495.0,117.0,67.1,9.5,0.4,16.2,5.4,1.4,37.0,1.9,103.0,93.0,389.0,8.0,1.14,0.0,1.0,1.0,0.0,7.0,0.22,0.04,0.6,82.0,82.0,0.0,0.0
03048,03 LEGUMES,"Cowpeas, dry, water-soaked, boiled in different water (without salt, water not discarded)",1.0,299.0,71.0,80.1,5.7,0.3,9.8,3.2,0.8,27.0,1.4,74.0,62.0,313.0,7.0,0.76,0.0,,,,,,,,,,,
03049,03 LEGUMES,"Cowpeas, fresh, boiled, drained (without salt)",1.0,554.0,132.0,61.8,4.8,0.6,22.6,8.4,1.8,200.0,1.4,51.0,80.0,361.0,5.0,1.27,3.0,,,,,,,,,,,
03050,03 LEGUMES,"Garden peas, fresh, boiled, drained (without salt)",,413.0,98.0,71.1,8.3,0.7,10.4,8.5,1.1,28.0,2.1,19.0,102.0,131.0,3.0,3.67,2.0,,,,,,,,,,,
03051,03 LEGUMES,"Garden peas, dry, unsoaked, boiled, drained (without salt)",1.0,506.0,120.0,66.8,7.6,0.7,17.7,6.3,1.0,20.0,1.5,38.0,107.0,259.0,7.0,1.07,19.0,,,,,,,,,,,
03052,03 LEGUMES,"Garden peas, unsoaked, boiled (without salt, water not discarded)",1.0,321.0,76.0,78.9,4.8,0.4,11.2,4.0,0.6,16.0,1.1,28.0,76.0,220.0,6.0,0.75,12.0,1.0,3.0,0.0,15.0,0.17,0.04,0.5,16.0,16.0,0.0,1.0
03053,03 LEGUMES,"Garden peas, dry, water-soaked, boiled in different water, drained (without salt)",1.0,506.0,120.0,66.8,7.6,0.7,17.7,6.3,1.0,20.0,1.5,38.0,107.0,259.0,7.0,1.07,19.0,,,,,,,,,,,
03054,03 LEGUMES AND PULSES,"Garden peas, dry, water-soaked, boiled in different water (without salt, water not discarded)",1.0,321.0,76.0,78.9,4.8,0.4,11.2,4.0,0.6,16.0,1.1,28.0,76.0,220.0,6.0,0.75,12.0,1.0,3.0,0.0,15.0,0.17,0.04,0.5,16.0,16.0,0.0,1.0
03055,03 LEGUMES AND PULSES,"Gram, black, dry, unsoaked, boiled, drained (without salt)",1.0,433.0,103.0,71.2,8.0,0.6,13.8,5.3,1.2,25.0,1.6,32.0,98.0,175.0,5.0,0.68,14.0,4.0,8.0,0.0,46.0,0.07,0.03,0.4,56.0,56.0,0.0,1.0
03056,03 LEGUMES AND PULSES,"Gram, black, dry, unsoaked, boiled (without salt, water not discarded)",1.0,290.0,69.0,80.7,5.3,0.4,9.2,3.5,0.8,20.0,1.3,25.0,73.0,157.0,5.0,0.51,9.0,,,,,,,,,,,
03057,03 LEGUMES AND PULSES,"Gram, black, dry, water-soaked, boiled in different water, drained (without salt)",1.0,433.0,103.0,71.2,8.0,0.6,13.8,5.3,1.2,25.0,1.6,32.0,98.0,175.0,5.0,0.68,14.0,4.0,8.0,0.0,46.0,0.07,0.03,0.4,56.0,56.0,0.0,1.0
03058,03 LEGUMES AND PULSES,"Gram, black, dry, water-soaked, boiled in different water (without salt, water not discarded)",1.0,290.0,69.0,80.7,5.3,0.4,9.2,3.5,0.8,20.0,1.3,25.0,73.0,157.0,5.0,0.51,9.0,,,,,,,,,,,
03059,03 LEGUMES AND PULSES,"Gram, green, dry, unsoaked, boiled, drained (without salt)",1.0,487.0,116.0,67.1,10.1,0.6,14.3,6.2,1.7,49.0,2.4,66.0,94.0,276.0,9.0,0.88,9.0,3.0,7.0,0.0,41.0,0.13,0.06,0.5,113.0,113.0,0.0,1.0
03060,03 LEGUMES AND PULSES,"Gram, green, dry, unsoaked, boiled (without salt, water not discarded)",1.0,309.0,73.0,79.2,6.4,0.4,9.0,3.9,1.1,38.0,1.8,50.0,66.0,233.0,8.0,0.62,6.0,,,,,,,,,,,
03061,03 LEGUMES AND PULSES,"Gram, green, dry, water-soaked, boiled in different water, drained (without salt)",1.0,487.0,116.0,67.1,10.1,0.6,14.3,6.2,1.7,49.0,2.4,66.0,94.0,276.0,9.0,0.88,9.0,3.0,7.0,0.0,41.0,0.13,0.06,0.5,113.0,113.0,0.0,1.0
03062,03 LEGUMES AND PULSES,"Gram, green, dry, water-soaked, boiled in different water (without salt, water not discarded)",1.0,309.0,73.0,79.2,6.4,0.4,9.0,3.9,1.1,38.0,1.8,50.0,66.0,233.0,8.0,0.62,6.0,,,,,,,,,,,
03063,03 LEGUMES AND PULSES,"Lentils, whole, dry, unsoaked, boiled, drained (without salt)",1.0,506.0,120.0,66.0,10.7,0.2,15.6,6.3,1.1,28.0,2.4,33.0,104.0,178.0,5.0,1.22,13.0,,,,,,,,,,,
03064,03 LEGUMES AND PULSES,"Lentils, whole, unsoaked, boiled (without salt, water not discarded)",1.0,316.0,75.0,78.8,6.7,0.2,9.7,4.0,0.7,21.0,1.7,24.0,72.0,148.0,5.0,0.85,8.0,0.0,0.0,0.0,2.0,0.08,0.04,0.5,19.0,19.0,0.0,1.0
03066,03 LEGUMES AND PULSES,"Lentils, whole, dry, water-soaked, boiled in different water (without salt, water not discarded)",1.0,316.0,75.0,78.8,6.7,0.2,9.7,4.0,0.7,21.0,1.7,24.0,72.0,148.0,5.0,0.85,8.0,0.0,0.0,0.0,2.0,0.08,0.04,0.5,19.0,19.0,0.0,1.0
03067,03 LEGUMES AND PULSES,"Pigeon peas, dry, unsoaked, boiled, drained (without salt)",1.0,553.0,132.0,61.8,9.1,0.9,16.9,9.6,1.7,65.0,2.0,48.0,106.0,391.0,8.0,1.13,7.0,8.0,17.0,0.0,100.0,0.2,0.05,0.7,74.0,74.0,0.0,0.0
03068,03 LEGUMES AND PULSES,"Pigeon peas, dry, unsoaked, boiled (without salt, water not discarded)",1.0,398.0,95.0,72.5,6.5,0.7,12.1,6.9,1.2,56.0,1.7,41.0,85.0,375.0,8.0,0.91,5.0,,,,,,,,,,,
03069,03 LEGUMES AND PULSES,"Pigeon peas, dry, water-soaked, boiled in different water, drained (without salt)",1.0,553.0,132.0,61.8,9.1,0.9,16.9,9.6,1.7,65.0,2.0,48.0,106.0,391.0,8.0,1.13,7.0,8.0,17.0,0.0,100.0,0.2,0.05,0.7,74.0,74.0,0.0,0.0
03070,03 LEGUMES AND PULSES,"Pigeon peas, dry, water-soaked, boiled in different water (without salt, water not discarded)",1.0,398.0,95.0,72.5,6.5,0.7,12.1,6.9,1.2,56.0,1.7,41.0,85.0,375.0,8.0,0.91,5.0,,,,,,,,,,,
03071,03 LEGUMES AND PULSES,"Soybean, dry, unsoaked, boiled, drained (without salt)",1.0,661.0,159.0,64.0,14.0,7.9,4.0,7.9,2.2,81.0,2.5,72.0,142.0,533.0,4.0,1.42,9.0,,,,,,,,,,,
03072,03 LEGUMES AND PULSES,"Soybean, dry, water-soaked, boiled in different water, drained (without salt)",1.0,661.0,159.0,64.0,14.0,7.9,4.0,7.9,2.2,81.0,2.5,72.0,142.0,533.0,4.0,1.42,9.0,0.0,0.0,0.0,2.0,0.19,0.05,0.7,74.0,74.0,0.0,0.0
04001,04 VEGETABLE AND VEGETABLE PROCUCTS,"Amaranth, leaves, picked, raw",,,,,,,,,,280.0,6.8,122.0,89.0,597.0,18.0,0.92,22.0,326.0,652.0,0.0,3913.0,0.03,0.22,0.69,64.0,64.0,0.0,77.0
04002,04 VEGETABLE AND VEGETABLE PROCUCTS,"Bitter gourd, whole, different varieties, raw",0.97,135.0,32.0,89.6,1.5,0.2,4.2,3.7,0.8,22.0,1.4,20.0,51.0,210.0,16.0,0.37,5.0,11.0,21.0,0.0,126.0,0.07,0.04,0.3,45.0,45.0,0.0,60.0
04003,04 VEGETABLE AND VEGETABLE PROCUCTS,"Black (African) nightshade, indigenous, leaves, picked, raw",0.52,127.0,31.0,88.6,3.8,0.1,1.3,4.3,1.8,100.0,8.6,41.0,68.0,421.0,10.0,0.65,1.0,2.0,4.0,0.0,24.0,0.06,0.32,1.1,404.0,404.0,0.0,36.0
04004,04 VEGETABLE AND VEGETABLE PROCUCTS,"Broccoli, tops and stems, raw",0.6,143.0,34.0,89.0,3.3,0.3,2.7,3.7,1.0,66.0,0.8,21.0,75.0,336.0,22.0,1.0,1.0,25.0,51.0,0.0,303.0,0.1,0.22,0.5,48.0,48.0,0.0,103.0
04005,04 VEGETABLES AND VEGETABLE PRODUCTS,"Cabbage, leaf head, Chinese, raw",,,,,,,,,,36.0,1.4,10.0,40.0,250.0,16.0,0.0,1.0,16.0,32.0,0.0,190.0,0.03,0.04,0.4,170.0,170.0,0.0,20.0
04006,04 VEGETABLE AND VEGETABLE PROCUCTS,"Cabbage, leaf head, red raw",0.84,110.0,26.0,91.1,1.3,0.2,3.1,3.4,0.9,45.0,0.7,29.0,14.0,241.0,16.0,0.3,1.0,1.0,2.0,0.0,10.0,0.09,0.13,0.5,57.0,57.0,0.0,69.0
04007,04 VEGETABLES AND VEGETABLE PRODUCTS,"Cabbage, leaf head, white, raw",,,,,,,,,,47.0,0.5,9.0,40.0,313.0,37.0,0.2,1.0,0.0,0.0,0.0,0.0,0.04,0.04,0.4,15.0,15.0,0.0,50.0
04008,04 VEGETABLE AND VEGETABLE PROCUCTS,"Capsicum (sweet peper), green, raw",0.4,95.0,23.0,93.3,1.5,0.1,2.9,2.0,0.2,8.0,0.5,10.0,17.0,151.0,2.0,0.18,0.0,27.0,55.0,0.0,328.0,0.03,0.03,0.5,8.0,8.0,0.0,115.0
04009,04 VEGETABLE AND VEGETABLE PROCUCTS,"Capsicum (sweet peper), red, raw",0.4,110.0,26.0,92.4,1.7,0.2,3.5,1.8,0.4,4.0,0.3,6.0,24.0,174.0,2.0,0.2,1.0,21.0,41.0,0.0,246.0,0.04,0.05,1.0,52.0,52.0,0.0,156.0
04010,04 VEGETABLE AND VEGETABLE PROCUCTS,"Capsicum (sweet peper), yellow, raw",0.46,86.0,21.0,93.4,1.4,0.2,2.3,2.2,0.6,19.0,1.0,17.0,43.0,242.0,2.0,0.0,0.0,14.0,28.0,0.0,166.0,0.14,0.02,0.59,30.0,30.0,0.0,127.0
04011,04 VEGETABLE AND VEGETABLE PROCUCTS,"Carrot, peeled, raw",0.83,124.0,30.0,90.6,0.7,0.2,4.5,3.2,0.6,33.0,0.6,17.0,25.0,251.0,35.0,0.14,0.0,589.0,1180.0,0.0,7070.0,0.04,0.03,0.22,18.0,18.0,0.0,5.5
04012,04 VEGETABLES AND VEGETABLE PRODUCTS,"Cauliflower, tops and stems, raw",,,,,,,,,,17.0,0.8,11.0,49.0,292.0,30.0,0.0,1.0,0.0,0.0,0.0,2.0,0.06,0.09,0.5,44.0,44.0,0.0,70.0
04013,04 VEGETABLES AND VEGETABLE PRODUCTS,"Celery, stalk, raw",,,,,,,,,,70.0,1.0,19.0,50.0,267.0,28.0,0.21,2.0,39.0,78.0,0.0,465.0,0.03,0.03,0.4,13.0,13.0,0.0,12.0
04014,04 VEGETABLES AND VEGETABLE PRODUCTS,"Courgette, green, unpeeled, raw",,,,,,,,,,18.0,0.5,16.0,34.0,188.0,1.0,0.33,1.0,23.0,46.0,0.0,278.0,0.03,0.06,0.6,17.0,17.0,0.0,24.0
04015,04 VEGETABLES AND VEGETABLE PRODUCTS,"Cowpea, leaves, picked, raw",,,,,,,,,,188.0,2.7,47.0,17.0,485.0,31.0,1.0,1.0,36.0,72.0,0.0,0.0,0.49,0.37,1.6,95.0,95.0,0.0,50.0
04016,04 VEGETABLE AND VEGETABLE PROCUCTS,"Cucumber, green, unpeeled, raw",0.97,47.0,11.0,96.2,0.6,0.1,1.3,1.4,0.5,20.0,0.7,14.0,20.0,136.0,22.0,0.18,1.0,0.0,1.0,0.0,5.0,0.03,0.02,0.2,7.0,7.0,0.0,7.0
04017,04 VEGETABLES AND VEGETABLE PRODUCTS,"Eggplant / Brinjal, different varieties, whole edible, raw",,,,,,,,,,18.0,0.4,21.0,35.0,200.0,3.0,0.21,1.0,12.0,24.0,0.0,146.0,0.05,0.05,1.0,29.0,29.0,0.0,2.0
04018,04 VEGETABLE AND VEGETABLE PROCUCTS,"Jute mallow, picked leaves, raw",0.48,187.0,45.0,82.3,4.6,0.2,2.1,8.3,2.5,207.0,6.3,30.0,88.0,283.0,18.0,0.58,1.0,217.0,434.0,0.0,2603.0,0.09,0.34,0.53,117.0,117.0,0.0,44.5
04019,04 VEGETABLES AND VEGETABLE PRODUCTS,"Kale, Ethiopian (kanzera), leaves, raw",,,,,,,,,,117.0,5.7,54.0,51.0,639.0,7.0,0.7,0.0,118.0,236.0,0.0,1418.0,0.06,0.23,0.9,73.0,73.0,0.0,134.0
04020,04 VEGETABLE AND VEGETABLE PROCUCTS,Kale (sukuma wiki) raw,0.88,121.0,29.0,89.2,3.0,0.3,1.2,4.7,1.6,402.0,2.8,41.0,67.0,238.0,71.0,0.5,0.0,177.0,355.0,0.0,2127.0,0.11,0.13,1.0,62.0,62.0,0.0,134.0
04021,04 VEGETABLES AND VEGETABLE PRODUCTS,"Leeks, bulb and stem, raw",,,,,,,,,,78.0,1.8,14.0,54.0,202.0,17.0,0.3,1.0,20.0,40.0,0.0,242.0,0.14,0.0,0.0,64.0,64.0,0.0,21.0
04022,04 VEGETABLES AND VEGETABLE PRODUCTS,"Lettuce, not further defined, raw",,,,,,,,,,47.0,1.6,24.0,55.0,201.0,20.0,0.26,1.0,107.0,214.0,0.0,1285.0,0.08,0.05,0.26,66.0,66.0,0.0,10.0
04023,04 VEGETABLE AND VEGETABLE PROCUCTS,"Mushroom, fresh, raw",1.0,148.0,35.0,89.7,2.3,0.4,4.5,2.3,0.9,16.0,0.3,15.0,105.0,318.0,8.0,0.17,16.0,0.0,0.0,0.0,0.0,0.1,0.4,0.7,23.0,23.0,0.0,0.0
04024,04 VEGETABLES AND VEGETABLE PRODUCTS,"Mushroom, dried, raw",,,,,,,,,,24.0,5.5,136.0,702.0,326.0,5.0,8.7,0.0,0.0,0.0,0.0,0.0,0.24,0.17,3.77,163.0,163.0,0.0,0.0
04025,04 VEGETABLES AND VEGETABLE PRODUCTS,"Mushroom, raw, canned in brine (drained)",,,,,,,,,,4.0,1.0,4.0,54.0,24.0,300.0,0.0,16.0,4.0,7.0,0.0,42.0,0.23,0.05,1.3,22.0,22.0,0.0,3.0
04026,04 VEGETABLE AND VEGETABLE PROCUCTS,"Okra, fresh, raw",0.74,136.0,32.0,90.0,2.0,0.2,3.5,3.7,0.7,81.0,0.8,57.0,63.0,303.0,8.0,0.6,1.0,9.0,19.0,0.0,112.0,0.1,0.06,1.0,88.0,88.0,0.0,21.0
04027,04 VEGETABLES AND VEGETABLE PRODUCTS,"Pumpkin, flesh, yellow w/o seeds, raw",,,,,,,,,,17.0,0.2,12.0,31.0,178.0,14.0,0.21,1.0,126.0,252.0,0.0,1512.0,0.07,0.06,0.78,50.0,50.0,0.0,8.0
04028,04 VEGETABLE AND VEGETABLE PROCUCTS,"Pumpkin, leaves, raw",0.82,156.0,37.0,87.3,4.2,0.7,2.2,2.3,3.2,383.0,5.6,142.0,119.0,423.0,12.0,0.9,1.0,141.0,283.0,0.0,1695.0,0.07,0.12,1.49,36.0,36.0,,12.3
04029,04 VEGETABLES AND VEGETABLE PRODUCTS,"Spider plant, leaves, raw",,,,,,,,,,189.0,2.6,48.0,49.0,478.0,19.0,0.76,2.0,217.0,434.0,0.0,2603.0,0.1,0.12,1.3,346.0,346.0,0.0,64.0
04030,04 VEGETABLES AND VEGETABLE PRODUCTS,"Spinach, leaves, raw",,,,,,,,,,131.0,1.7,72.0,28.0,570.0,59.0,1.0,1.0,189.0,377.0,0.0,2260.0,0.03,0.18,0.4,110.0,110.0,0.0,37.0
04031,04 VEGETABLE AND VEGETABLE PROCUCTS,"Spinach, Swiss chard, leaves, raw",0.5,102.0,25.0,90.3,3.1,0.2,0.7,3.6,2.0,117.0,4.4,78.0,50.0,348.0,892.0,0.73,1.0,190.0,380.0,0.0,2280.0,0.03,0.1,0.6,121.0,121.0,0.0,24.0
04032,04 VEGETABLES AND VEGETABLE PRODUCTS,"Squash, butternut, peeled, flesh, raw",,,,,,,,,,18.0,1.0,16.0,19.0,332.0,7.7,0.2,1.0,160.0,320.0,0.0,1920.0,0.07,0.06,1.02,31.0,31.0,0.0,8.0
04033,04 VEGETABLES AND VEGETABLE PRODUCTS,"Stinging nettle, leaves, raw",,,,,,,,,,668.0,7.2,133.0,122.0,524.0,36.0,1.0,2.0,2.0,3.0,0.0,,0.04,0.0,1.0,457.0,457.0,0.0,5.0
04034,04 VEGETABLE AND VEGETABLE PROCUCTS,Sweet Potato (Leaves),1.0,150.0,36.0,87.6,4.3,0.5,0.8,5.3,1.4,118.0,1.0,61.0,30.0,620.0,6.0,0.29,1.0,,,,,,,,,,,
04035,04 VEGETABLES AND VEGETABLE PRODUCTS,"Tomato, green, raw",,,,,,,,,,8.0,0.4,14.0,23.0,225.0,13.0,0.2,8.0,3.0,5.0,0.0,32.0,0.08,0.1,0.5,9.0,9.0,0.0,16.0
04036,04 VEGETABLES AND VEGETABLE PRODUCTS,"Tomato, red, ripe, raw",,,,,,,,,,8.0,0.9,9.5,25.0,126.0,21.0,0.37,0.0,26.0,53.0,0.0,316.0,0.04,0.04,0.5,25.0,25.0,0.0,25.0
04037,04 VEGETABLES AND VEGETABLE PRODUCTS,"Tomato, canned, whole contents",,,,,,,,,,22.0,0.6,11.0,20.0,204.0,68.0,0.16,1.0,28.0,56.0,0.0,334.0,0.0,0.0,0.6,26.0,26.0,0.0,6.0
04038,04 VEGETABLE AND VEGETABLE PROCUCTS,"Vine (African) spinach, picked leaves, raw",0.94,117.0,28.0,90.4,3.4,0.7,0.2,3.7,1.6,267.0,10.9,40.0,56.0,446.0,8.0,0.5,0.0,184.0,369.0,0.0,2210.0,0.1,0.2,0.9,71.0,71.3,0.0,79.8
04039,04 VEGETABLE AND VEGETABLE PROCUCTS,"Amaranth, leaves, picked, boiled, drained (without salt)",1.0,158.0,38.0,83.8,3.9,0.3,1.3,7.6,3.2,280.0,5.3,77.0,84.0,314.0,14.0,0.73,20.0,309.0,618.0,0.0,3707.0,0.02,0.15,0.5,34.0,34.0,0.0,33.0
04040,04 VEGETABLE AND VEGETABLE PROCUCTS,"Amaranth, leaves, picked, stewed (without salt)",,,,,,,,,,346.0,8.3,151.0,110.0,737.0,22.0,1.14,27.0,362.0,725.0,0.0,4347.0,0.03,0.26,0.8,55.0,55.0,0.0,57.0
04041,04 VEGETABLE AND VEGETABLE PROCUCTS,"Bitter gourd, whole, different varieties, boiled, drained (without salt)",,,,,,,,,,23.0,1.2,13.0,51.0,117.0,14.0,0.31,5.0,11.0,21.0,0.0,126.0,0.05,0.03,0.2,25.0,25.0,0.0,43.0
04042,04 VEGETABLES AND VEGETABLE PRODUCTS,"Black (African) nightshade, indigenous, leaves, picked, boiled, drained (without salt)",,,,,,,,,,91.0,6.2,24.0,58.0,200.0,7.0,0.46,1.0,2.0,3.0,0.0,20.0,0.04,0.2,0.7,192.0,192.0,0.0,14.0
04044,04 VEGETABLES AND VEGETABLE PRODUCTS,"Broccoli, tops and stems, boiled, drained (without salt)",,,,,,,,,,56.0,0.6,11.0,61.0,151.0,15.0,0.41,0.0,20.0,41.0,0.0,246.0,0.06,0.13,0.3,22.0,22.0,0.0,60.0
04045,04 VEGETABLE AND VEGETABLE PROCUCTS,"Broccoli, tops and stems, steamed (without salt)",1.0,137.0,33.0,89.4,3.2,0.3,2.6,3.6,1.0,60.0,0.6,18.0,69.0,275.0,18.0,0.52,0.0,22.0,44.0,0.0,262.0,0.08,0.19,0.4,28.0,28.0,0.0,74.0
04046,04 VEGETABLE AND VEGETABLE PROCUCTS,"Cabbage, leaf head, Chinese, boiled, drained (without salt)",1.0,41.0,10.0,96.9,0.9,0.3,0.4,1.1,0.4,35.0,1.1,6.0,37.0,128.0,12.0,0.15,0.0,15.0,29.0,0.0,174.0,0.02,0.03,0.3,87.0,87.0,0.0,8.0
04047,04 VEGETABLES AND VEGETABLE PRODUCTS,"Cabbage, leaf head, Chinese, steamed (without salt)",,,,,,,,,,35.0,1.2,9.0,39.0,217.0,14.0,0.18,0.0,15.0,29.0,0.0,174.0,0.02,0.04,0.3,104.0,104.0,0.0,11.0
04048,04 VEGETABLES AND VEGETABLE PRODUCTS,"Cabbage, leaf head, red, boiled, drained (without salt)",,,,,,,,,,44.0,0.5,18.0,13.0,123.0,12.0,0.23,1.0,1.0,2.0,0.0,9.0,0.06,0.09,0.3,29.0,29.0,0.0,28.0
04049,04 VEGETABLE AND VEGETABLE PROCUCTS,"Cabbage, leaf head, red, stewed (without salt)",1.0,102.0,24.0,91.7,1.2,0.2,2.9,3.1,0.8,42.0,0.7,27.0,13.0,223.0,15.0,0.28,1.0,1.0,1.0,0.0,8.0,0.08,0.11,0.4,37.0,37.0,0.0,38.0
04050,04 VEGETABLE AND VEGETABLE PROCUCTS,"Cabbage, leaf head, white, boiled, drained (without salt)",1.0,78.0,19.0,93.6,1.1,0.1,2.2,2.3,0.7,45.0,0.4,6.0,36.0,159.0,29.0,0.18,0.0,0.0,0.0,0.0,0.0,0.03,0.03,0.3,8.0,8.0,0.0,20.0
04051,04 VEGETABLES AND VEGETABLE PRODUCTS,"Cabbage, leaf head, white, stewed (without salt)",,,,,,,,,,50.0,0.5,10.0,43.0,336.0,40.0,0.25,1.0,0.0,0.0,0.0,0.0,0.04,0.04,0.4,11.0,11.0,0.0,32.0
04052,04 VEGETABLES AND VEGETABLE PRODUCTS,"Capsicum (sweet peper), green, boiled, drained (without salt)",,,,,,,,,,9.0,0.5,7.0,18.0,87.0,2.0,0.16,0.0,28.0,57.0,0.0,339.0,0.02,0.02,0.4,5.0,5.0,0.0,86.0
04053,04 VEGETABLE AND VEGETABLE PROCUCTS,"Capsicum (sweet peper), green, grilled (without salt and fat)",1.0,102.0,24.0,92.8,1.6,0.1,3.1,2.2,0.2,9.0,0.6,11.0,18.0,162.0,2.0,0.19,0.0,26.0,53.0,0.0,317.0,0.03,0.03,0.5,6.0,6.0,0.0,99.0
04054,04 VEGETABLES AND VEGETABLE PRODUCTS,"Capsicum (sweet peper), green, baked (without salt)",,,,,,,,,,8.0,0.6,10.0,18.0,157.0,2.0,0.19,0.0,26.0,51.0,0.0,308.0,0.03,0.03,0.5,6.0,6.0,0.0,96.0
04055,04 VEGETABLES AND VEGETABLE PRODUCTS,"Capsicum (sweet peper), red, boiled, drained (without salt)",,,,,,,,,,4.0,0.3,4.0,25.0,100.0,2.0,0.17,1.0,21.0,42.0,0.0,254.0,0.03,0.04,0.7,30.0,30.0,0.0,117.0
04056,04 VEGETABLE AND VEGETABLE PROCUCTS,"Capsicum (sweet peper), red, grilled (without salt and fat)",1.0,118.0,28.0,91.8,1.8,0.2,3.8,1.9,0.4,4.0,0.3,6.0,26.0,187.0,2.0,0.22,1.0,20.0,40.0,0.0,238.0,0.04,0.05,1.0,39.0,39.0,0.0,134.0
04057,04 VEGETABLES AND VEGETABLE PRODUCTS,"Capsicum (sweet peper), red, baked (without salt)",,,,,,,,,,4.0,0.3,6.0,25.0,181.0,2.0,0.21,1.0,19.0,38.0,0.0,231.0,0.04,0.05,1.0,38.0,38.0,0.0,130.0
04058,04 VEGETABLES AND VEGETABLE PRODUCTS,"Capsicum (sweet peper), yellow, boiled, drained (without salt)",,,,,,,,,,21.0,0.6,12.0,45.0,139.0,1.0,0.22,0.0,14.0,29.0,0.0,172.0,0.1,0.01,0.4,17.0,17.0,0.0,95.0
04059,04 VEGETABLE AND VEGETABLE PROCUCTS,"Capsicum (sweet peper), yellow, grilled (without salt and fat)",1.0,93.0,22.0,92.9,1.5,0.2,2.4,2.4,0.7,21.0,0.7,19.0,47.0,260.0,2.0,0.28,0.0,13.0,27.0,0.0,161.0,0.14,0.02,0.6,23.0,23.0,0.0,109.0
04060,04 VEGETABLES AND VEGETABLE PRODUCTS,"Capsicum (sweet peper), yellow, baked (without salt)",,,,,,,,,,20.0,0.7,18.0,45.0,252.0,2.0,0.27,0.0,13.0,26.0,0.0,156.0,0.13,0.02,0.6,22.0,22.0,0.0,106.0
04061,04 VEGETABLES AND VEGETABLE PRODUCTS,"Carrot, peeled, boiled, drained (without salt)",,,,,,,,,,34.0,0.5,11.0,24.0,120.0,21.0,0.11,0.0,564.0,1130.0,0.0,6770.0,0.03,0.02,0.2,10.0,10.0,0.0,2.0
04062,04 VEGETABLE AND VEGETABLE PROCUCTS,"Carrot, peeled, stewed (without salt)",1.0,129.0,31.0,90.2,0.8,0.2,4.7,3.4,0.7,35.0,0.6,17.0,26.0,261.0,37.0,0.14,0.0,552.0,1110.0,0.0,6630.0,0.04,0.03,0.2,13.0,13.0,0.0,5.0
04063,04 VEGETABLE AND VEGETABLE PROCUCTS,"Cauliflower, tops and stems, boiled, drained (without salt)",1.0,79.0,19.0,93.2,2.0,0.2,0.9,2.8,0.9,16.0,0.6,6.0,44.0,146.0,23.0,0.19,0.0,0.0,0.0,0.0,1.0,0.04,0.06,0.3,22.0,22.0,0.0,46.0
04064,04 VEGETABLE AND VEGETABLE PROCUCTS,"Celery, stalk, boiled, drained (without salt)",1.0,127.0,30.0,89.9,0.7,0.1,5.8,1.6,1.9,74.0,0.8,13.0,50.0,148.0,23.0,0.18,2.0,39.0,78.0,0.0,465.0,0.02,0.02,0.3,7.0,7.0,0.0,9.0
04065,04 VEGETABLE AND VEGETABLE PROCUCTS,"Courgette, green, unpeeled, boiled, drained (without salt)",1.0,86.0,21.0,94.2,1.0,0.3,2.8,1.2,0.4,19.0,0.4,11.0,34.0,104.0,1.0,0.28,1.0,14.0,28.0,0.0,168.0,0.02,0.04,0.4,9.0,9.0,0.0,17.0
04066,04 VEGETABLE AND VEGETABLE PROCUCTS,"Cowpea, leaves, picked, boiled, drained (without salt)",1.0,117.0,28.0,89.2,3.2,0.4,0.6,4.7,1.8,170.0,1.9,27.0,15.0,231.0,22.0,0.53,0.0,0.0,0.0,0.0,0.0,0.3,0.23,1.0,45.0,45.0,0.0,19.0
04067,04 VEGETABLES AND VEGETABLE PRODUCTS,"Cowpea, leaves, picked, steamed (without salt)",,,,,,,,,,155.0,1.9,37.0,14.0,358.0,23.0,0.58,0.0,0.0,0.0,0.0,0.0,0.34,0.29,1.1,49.0,49.0,0.0,24.0
04068,04 VEGETABLE AND VEGETABLE PROCUCTS,"Eggplant / Brinjal, different varieties, whole edible, boiled, drained (without salt)",1.0,119.0,29.0,90.1,1.3,0.3,3.0,4.3,1.0,19.0,0.3,14.0,34.0,108.0,2.0,0.17,0.0,12.0,24.0,0.0,141.0,0.03,0.03,0.4,16.0,16.0,0.0,1.0
04069,04 VEGETABLES AND VEGETABLE PRODUCTS,"Eggplant / Brinjal, different varieties, whole edible, stewed (without salt)",,,,,,,,,,23.0,0.5,26.0,44.0,250.0,4.0,0.26,1.0,14.0,27.0,0.0,164.0,0.06,0.06,0.6,25.0,25.0,0.0,2.0
04070,04 VEGETABLES AND VEGETABLE PRODUCTS,"Jute mallow, picked leaves, boiled, drained (without salt)",,,,,,,,,,207.0,5.0,19.0,84.0,149.0,14.0,0.46,1.0,205.0,411.0,0.0,2466.0,0.06,0.23,0.4,61.0,61.0,0.0,18.3
04071,04 VEGETABLE AND VEGETABLE PROCUCTS,"Jute mallow, picked leaves, stewed (without salt)",1.0,231.0,56.0,78.2,5.7,0.2,2.6,10.2,3.1,255.0,7.8,37.0,109.0,349.0,23.0,0.72,1.0,241.0,482.0,0.0,2892.0,0.1,0.4,0.6,101.0,101.0,0.0,32.2
04072,04 VEGETABLE AND VEGETABLE PROCUCTS,"Kale, Ethiopian (kanzera), leaves, boiled, drained (without salt)",1.0,108.0,26.0,90.8,3.1,0.6,0.2,3.8,1.5,105.0,4.0,31.0,43.0,304.0,5.0,0.48,0.0,101.0,203.0,0.0,1215.0,0.04,0.14,0.6,35.0,35.0,0.0,51.0
04073,04 VEGETABLES AND VEGETABLE PRODUCTS,"Kale, Ethiopian (kanzera), leaves, steamed (without salt)",,,,,,,,,,96.0,3.9,42.0,42.0,472.0,5.0,0.52,0.0,92.0,185.0,0.0,1109.0,0.04,0.18,0.6,38.0,38.0,0.0,64.0
04074,04 VEGETABLES AND VEGETABLE PRODUCTS,"Kale (sukuma wiki), boiled, drained (without salt)",,,,,,,,,,364.0,2.0,23.0,57.0,113.0,51.0,0.34,0.0,152.0,304.0,0.0,1823.0,0.07,0.08,0.6,30.0,30.0,0.0,51.0
04075,04 VEGETABLE AND VEGETABLE PROCUCTS,"Kale (sukuma wiki), steamed (without salt)",1.0,105.0,25.0,90.6,2.6,0.3,1.1,4.1,1.4,332.0,2.0,32.0,55.0,176.0,53.0,0.37,0.0,139.0,277.0,0.0,1665.0,0.08,0.1,0.7,33.0,33.0,0.0,64.0
04076,04 VEGETABLE AND VEGETABLE PROCUCTS,"Leeks, bulb and stem, boiled, drained (without salt)",1.0,276.0,66.0,81.4,2.0,0.5,11.4,3.7,1.0,90.0,1.6,10.0,58.0,110.0,11.0,0.27,1.0,22.0,44.0,0.0,262.0,0.12,0.07,0.3,39.0,39.0,0.0,10.0
04077,04 VEGETABLES AND VEGETABLE PRODUCTS,"Mushroom, fresh, boiled, drained (without salt)",,,,,,,,,,21.0,0.3,12.0,129.0,218.0,8.0,0.17,20.0,0.0,0.0,0.0,0.0,0.09,0.36,0.6,16.0,16.0,0.0,0.0
04078,04 VEGETABLE AND VEGETABLE PROCUCTS,"Mushroom, fresh, stewed (without salt)",1.0,183.0,43.0,87.3,2.8,0.5,5.5,2.8,1.1,20.0,0.4,19.0,130.0,393.0,10.0,0.21,20.0,0.0,0.0,0.0,0.0,0.11,0.47,0.8,20.0,20.0,0.0,0.0
04079,04 VEGETABLE AND VEGETABLE PROCUCTS,"Mushroom, dried, boiled, drained (without salt)",1.0,674.0,162.0,49.6,7.0,1.6,18.5,22.4,0.8,14.0,2.3,47.0,361.0,93.0,3.0,3.72,0.0,0.0,0.0,0.0,0.0,0.09,0.06,1.4,47.0,47.0,0.0,0.0
04080,04 VEGETABLES AND VEGETABLE PRODUCTS,"Okra, fresh, boiled, drained (without salt)",,,,,,,,,,70.0,0.5,31.0,52.0,138.0,5.0,0.41,1.0,8.0,15.0,0.0,91.0,0.05,0.04,0.6,40.0,40.0,0.0,12.0
04081,04 VEGETABLE AND VEGETABLE PROCUCTS,"Okra, fresh, stewed (without salt)",,147.0,35.0,88.7,2.2,0.2,6.1,4.0,1.8,84.0,0.7,56.0,65.0,280.0,7.0,0.59,1.0,9.0,18.0,0.0,109.0,0.08,0.06,0.9,57.0,57.0,0.0,17.0
04082,04 VEGETABLE AND VEGETABLE PROCUCTS,"Pumpkin, flesh, yellow w/o seeds, boiled, drained (without salt)",1.0,146.0,35.0,89.5,1.3,0.2,5.6,2.6,0.8,18.0,0.2,8.0,30.0,97.0,11.0,0.17,0.0,123.0,246.0,0.0,1479.0,0.05,0.04,0.5,27.0,27.0,0.0,6.0
04083,04 VEGETABLES AND VEGETABLE PRODUCTS,"Pumpkin, flesh, yellow w/o seeds, boiled, drained (without salt)",,,,,,,,,,15.0,0.2,11.0,27.0,157.0,12.0,0.19,0.0,100.0,201.0,0.0,1204.0,0.06,0.05,0.7,31.0,31.0,0.0,6.0
04084,04 VEGETABLES AND VEGETABLE PRODUCTS,"Pumpkin, leaves, boiled, drained (without salt)",,,,,,,,,,347.0,4.0,81.0,102.0,201.0,9.0,0.64,1.0,121.0,242.0,0.0,1453.0,0.04,0.07,0.9,17.0,17.0,0.0,5.0
04085,04 VEGETABLE AND VEGETABLE PROCUCTS,"Pumpkin, leaves, steamed (without salt)",1.0,135.0,32.0,89.0,3.7,0.6,1.9,2.0,2.8,316.0,3.9,111.0,98.0,313.0,9.0,0.7,1.0,111.0,221.0,0.0,1327.0,0.05,0.09,1.0,19.0,19.0,0.0,6.0
04086,04 VEGETABLE AND VEGETABLE PROCUCTS,"Spider plant, leaves, boiled, drained (without salt)",1.0,172.0,41.0,85.7,4.6,0.7,2.0,4.1,2.9,171.0,1.9,27.0,42.0,228.0,13.0,0.54,2.0,186.0,372.0,0.0,2231.0,0.06,0.07,0.8,165.0,165.0,0.0,24.0
04087,04 VEGETABLE AND VEGETABLE PROCUCTS,"Spider plant, leaves, steamed (without salt)",1.0,157.0,38.0,86.9,4.2,0.7,1.9,3.8,2.6,156.0,1.8,37.0,40.0,353.0,14.0,0.59,1.0,170.0,339.0,0.0,2037.0,0.07,0.09,0.9,181.0,181.0,0.0,31.0
04088,04 VEGETABLE AND VEGETABLE PROCUCTS,"Spinach, leaves, boiled, drained (without salt)",1.0,118.0,28.0,89.3,2.9,0.4,1.2,4.3,1.9,131.0,1.4,45.0,27.0,300.0,46.0,0.47,0.0,179.0,357.0,0.0,2140.0,0.02,0.12,0.3,58.0,58.0,0.0,15.0
04089,04 VEGETABLES AND VEGETABLE PRODUCTS,"Spinach, leaves, stewed (without salt)",,,,,,,,,,161.0,2.1,89.0,35.0,704.0,72.0,0.74,1.0,209.0,419.0,0.0,2510.0,0.03,0.21,0.5,95.0,95.0,0.0,27.0
04090,04 VEGETABLES AND VEGETABLE PRODUCTS,"Spinach, Swiss chard, leaves, boiled, drained (without salt)",,,,,,,,,,117.0,3.5,49.0,47.0,183.0,704.0,0.58,1.0,180.0,360.0,0.0,2160.0,0.02,0.07,0.4,64.0,64.0,0.0,10.0
04091,04 VEGETABLE AND VEGETABLE PROCUCTS,"Spinach, Swiss chard, leaves, stewed (without salt)",1.0,126.0,30.0,88.0,3.9,0.3,0.9,4.5,2.5,144.0,5.4,96.0,62.0,430.0,1101.0,0.9,1.0,211.0,422.0,0.0,2530.0,0.03,0.12,0.7,105.0,105.0,0.0,18.0
04092,04 VEGETABLE AND VEGETABLE PROCUCTS,"Squash, butternut, peeled, flesh, boiled, drained (without salt)",1.0,204.0,48.0,85.7,1.6,0.1,8.8,2.8,0.9,19.0,0.8,11.0,20.0,186.0,7.0,0.16,1.0,162.0,324.0,0.0,1940.0,0.05,0.04,0.7,18.0,18.0,0.0,6.0
04093,04 VEGETABLES AND VEGETABLE PRODUCTS,"Squash, butternut, peeled, flesh, steamed (without salt)",,,,,,,,,,19.0,0.9,16.0,21.0,317.0,7.0,0.2,1.0,162.0,324.0,0.0,1940.0,0.06,0.06,0.9,21.0,21.0,0.0,7.0
04094,04 VEGETABLE AND VEGETABLE PROCUCTS,"Squash, butternut, peeled, flesh, baked (without salt)",1.0,214.0,51.0,85.1,1.7,0.1,9.2,2.9,1.0,21.0,1.2,19.0,23.0,390.0,9.0,0.23,1.0,169.0,339.0,0.0,2030.0,0.07,0.06,1.1,26.0,26.0,0.0,8.0
04095,04 VEGETABLE AND VEGETABLE PROCUCTS,"Stinging nettle, leaves, boiled, drained (without salt)",1.0,237.0,56.0,81.1,5.1,0.7,6.4,2.0,4.7,604.0,5.2,76.0,105.0,250.0,26.0,0.49,2.0,0.0,0.0,0.0,0.0,0.02,0.19,0.7,218.0,218.0,0.0,2.0
04096,04 VEGETABLES AND VEGETABLE PRODUCTS,"Stinging nettle, leaves, steamed (without salt)",,,,,,,,,,552.0,5.0,104.0,101.0,387.0,27.0,0.54,2.0,0.0,0.0,0.0,0.0,0.03,0.24,0.7,238.0,238.0,0.0,2.0
04097,04 VEGETABLE AND VEGETABLE PROCUCTS,"Tomato, green, boiled, drained (without salt)",1.0,121.0,29.0,91.3,1.4,0.3,4.2,2.1,0.8,10.0,0.4,10.0,26.0,144.0,13.0,0.15,10.0,3.0,6.0,0.0,37.0,0.07,0.04,0.4,6.0,6.0,0.0,14.0
04098,04 VEGETABLE AND VEGETABLE PROCUCTS,"Tomato, red, ripe, boiled, drained (without salt)",1.0,118.0,28.0,91.8,1.3,0.3,4.2,1.8,0.7,10.0,0.8,7.0,28.0,81.0,20.0,0.35,0.0,30.0,61.0,0.0,365.0,0.04,0.04,0.5,16.0,16.0,0.0,21.0
